{
  "schema": "rollcall-report/1",
  "generated": "2026-01-02T03:04:05Z",
  "tool": {
    "name": "rollcall",
    "version": "0.0.1"
  },
  "product": {
    "name": "sensor-node",
    "version": "1.0.0"
  },
  "summary": "This report checks how ready the software bill of materials (SBOM) of sensor-node 1.0.0 is to hand to a customer or regulator. Its readiness score is 100 out of 100. The SBOM lists 8 items in total: the product, 3 firmware images and 4 software components. 8 of them carry an identifier (a PURL or CPE) that vulnerability databases can match, 8 a file hash that proves exactly which file was shipped, and 8 a licence. No unresolved modules. The SBOM is valid CycloneDX 1.6 and meets every CISA 2026 and EU Cyber Resilience Act minimum element rollcall checks. No vulnerability scan was supplied, so known vulnerabilities were not checked and are not part of the score.",
  "score": {
    "value": 100,
    "basis_points": 10000,
    "weight_assessed": 90,
    "scan_supplied": false,
    "categories": [
      {
        "id": "identified",
        "weight": 25,
        "assessed": true,
        "numerator": 8,
        "denominator": 8,
        "earned": 250000
      },
      {
        "id": "hashed",
        "weight": 15,
        "assessed": true,
        "numerator": 8,
        "denominator": 8,
        "earned": 150000
      },
      {
        "id": "licensed",
        "weight": 15,
        "assessed": true,
        "numerator": 8,
        "denominator": 8,
        "earned": 150000
      },
      {
        "id": "validation",
        "weight": 25,
        "assessed": true,
        "numerator": 8,
        "denominator": 8,
        "earned": 250000
      },
      {
        "id": "modules",
        "weight": 10,
        "assessed": true,
        "numerator": 0,
        "denominator": 0,
        "earned": 100000
      },
      {
        "id": "vulnerabilities",
        "weight": 10,
        "assessed": false,
        "numerator": 0,
        "denominator": 0,
        "earned": 0
      }
    ]
  },
  "coverage": {
    "nodes": 8,
    "purl": {
      "count": 7,
      "basis_points": 8750
    },
    "cpe": {
      "count": 4,
      "basis_points": 5000
    },
    "identified": {
      "count": 8,
      "basis_points": 10000
    },
    "hash": {
      "count": 8,
      "basis_points": 10000
    },
    "licence": {
      "count": 8,
      "basis_points": 10000
    }
  },
  "components": [
    {
      "level": "product",
      "path": "sensor-node",
      "type": "firmware",
      "name": "sensor-node",
      "version": "1.0.0",
      "bom_ref": "product:ee193673a5716110c2e95bc112363dcb",
      "purl": true,
      "cpe": true,
      "hash": true,
      "licence": true
    },
    {
      "level": "image",
      "path": "mcuboot",
      "type": "firmware",
      "name": "mcuboot",
      "version": "2.1.0",
      "bom_ref": "image:911161f57a3714ad122b6ea305d680fd",
      "purl": true,
      "cpe": false,
      "hash": true,
      "licence": true
    },
    {
      "level": "image",
      "path": "sensor-app",
      "type": "firmware",
      "name": "sensor-app",
      "version": "1.0.0",
      "bom_ref": "image:613cff03dcdbf6304ca51767e2ff80b3",
      "purl": true,
      "cpe": false,
      "hash": true,
      "licence": true
    },
    {
      "level": "component",
      "path": "sensor-app / littlefs",
      "type": "library",
      "name": "littlefs",
      "version": "2.9.0",
      "bom_ref": "component:929a445c0e3c76a5f601071900b671b9",
      "purl": true,
      "cpe": false,
      "hash": true,
      "licence": true
    },
    {
      "level": "component",
      "path": "sensor-app / mbedtls",
      "type": "library",
      "name": "mbedtls",
      "version": "3.6.4",
      "bom_ref": "component:490ab4fe086503c17e430dc3eabb2df9",
      "purl": true,
      "cpe": true,
      "hash": true,
      "licence": true
    },
    {
      "level": "component",
      "path": "sensor-app / zephyr",
      "type": "operating-system",
      "name": "zephyr",
      "version": "4.2.0",
      "bom_ref": "component:e7da5136d5eaf78baff59bb4945f97f9",
      "purl": true,
      "cpe": true,
      "hash": true,
      "licence": true
    },
    {
      "level": "image",
      "path": "radio-fw",
      "type": "firmware",
      "name": "radio-fw",
      "version": "6.0.0",
      "bom_ref": "image:840c2251d4a3fcaa4c8d9ec6dd5d2501",
      "purl": true,
      "cpe": false,
      "hash": true,
      "licence": true
    },
    {
      "level": "component",
      "path": "radio-fw / sdc",
      "type": "firmware",
      "name": "sdc",
      "version": "6.0.0",
      "bom_ref": "component:e66735306088ef37e3383a98a12c4958",
      "purl": false,
      "cpe": true,
      "hash": true,
      "licence": true
    }
  ],
  "unresolved": [],
  "findings": null,
  "vex": null,
  "validation": {
    "schema": {
      "valid": true,
      "violations": []
    },
    "profiles": {
      "profiles": [
        "cisa-2026",
        "cra"
      ],
      "passed": true,
      "errors": 0,
      "warnings": 0,
      "findings": []
    }
  },
  "warnings": []
}
