{
  "schema": "rollcall-report/1",
  "generated": "2026-01-02T03:04:05Z",
  "tool": {
    "name": "rollcall",
    "version": "0.0.1"
  },
  "product": {
    "name": "hello_world",
    "version": "1"
  },
  "summary": "This report checks how ready the software bill of materials (SBOM) of hello_world 1 is to hand to a customer or regulator. Its readiness score is 35 out of 100. The SBOM lists 3 items in total: the product, 1 firmware image and 1 software component. 2 of them carry an identifier (a PURL or CPE) that vulnerability databases can match, 0 a file hash that proves exactly which file was shipped, and 1 a licence. No unresolved modules. The SBOM is valid CycloneDX 1.6; the CISA 2026 and EU Cyber Resilience Act checks found 6 problems to fix and 0 recommendations. No vulnerability scan was supplied, so known vulnerabilities were not checked and are not part of the score.",
  "score": {
    "value": 35,
    "basis_points": 3518,
    "weight_assessed": 90,
    "scan_supplied": false,
    "categories": [
      {
        "id": "identified",
        "weight": 25,
        "assessed": true,
        "numerator": 2,
        "denominator": 3,
        "earned": 166666
      },
      {
        "id": "hashed",
        "weight": 15,
        "assessed": true,
        "numerator": 0,
        "denominator": 3,
        "earned": 0
      },
      {
        "id": "licensed",
        "weight": 15,
        "assessed": true,
        "numerator": 1,
        "denominator": 3,
        "earned": 50000
      },
      {
        "id": "validation",
        "weight": 25,
        "assessed": true,
        "numerator": 0,
        "denominator": 3,
        "earned": 0
      },
      {
        "id": "modules",
        "weight": 10,
        "assessed": true,
        "numerator": 0,
        "denominator": 0,
        "earned": 100000
      },
      {
        "id": "vulnerabilities",
        "weight": 10,
        "assessed": false,
        "numerator": 0,
        "denominator": 0,
        "earned": 0
      }
    ]
  },
  "coverage": {
    "nodes": 3,
    "purl": {
      "count": 2,
      "basis_points": 6666
    },
    "cpe": {
      "count": 1,
      "basis_points": 3333
    },
    "identified": {
      "count": 2,
      "basis_points": 6666
    },
    "hash": {
      "count": 0,
      "basis_points": 0
    },
    "licence": {
      "count": 1,
      "basis_points": 3333
    }
  },
  "components": [
    {
      "level": "product",
      "path": "hello_world",
      "type": "firmware",
      "name": "hello_world",
      "version": "1",
      "bom_ref": "product:5d32bde1e0464bf06d5c15377396edd4",
      "purl": false,
      "cpe": false,
      "hash": false,
      "licence": false
    },
    {
      "level": "image",
      "path": "hello_world",
      "type": "firmware",
      "name": "hello_world",
      "version": "1",
      "bom_ref": "image:f4f8ff8a9d6968ac2df28fe1bc80cfcc",
      "purl": true,
      "cpe": false,
      "hash": false,
      "licence": false
    },
    {
      "level": "component",
      "path": "hello_world / esp-idf",
      "type": "framework",
      "name": "esp-idf",
      "version": "5.5.1",
      "bom_ref": "component:cd7e20e7cd7979bc031ad65866ba6198",
      "purl": true,
      "cpe": true,
      "hash": false,
      "licence": true
    }
  ],
  "unresolved": [],
  "findings": null,
  "vex": null,
  "validation": {
    "schema": {
      "valid": true,
      "violations": []
    },
    "profiles": {
      "profiles": [
        "cisa-2026",
        "cra"
      ],
      "passed": false,
      "errors": 6,
      "warnings": 0,
      "findings": [
        {
          "check": "component.hash",
          "severity": "error",
          "profiles": [
            "cisa-2026",
            "cra"
          ],
          "component": "hello_world",
          "level": "product",
          "pointer": null,
          "message": "no hash"
        },
        {
          "check": "component.identifier",
          "severity": "error",
          "profiles": [
            "cisa-2026",
            "cra"
          ],
          "component": "hello_world",
          "level": "product",
          "pointer": null,
          "message": "no unique identifier (cpe, purl missing)"
        },
        {
          "check": "component.supplier",
          "severity": "error",
          "profiles": [
            "cisa-2026",
            "cra"
          ],
          "component": "hello_world",
          "level": "product",
          "pointer": null,
          "message": "no supplier (manufacturer.name and supplier.name missing)"
        },
        {
          "check": "component.hash",
          "severity": "error",
          "profiles": [
            "cisa-2026",
            "cra"
          ],
          "component": "hello_world",
          "level": "image",
          "pointer": null,
          "message": "no hash"
        },
        {
          "check": "component.supplier",
          "severity": "error",
          "profiles": [
            "cisa-2026",
            "cra"
          ],
          "component": "hello_world",
          "level": "image",
          "pointer": null,
          "message": "no supplier (manufacturer.name and supplier.name missing)"
        },
        {
          "check": "component.hash",
          "severity": "error",
          "profiles": [
            "cisa-2026",
            "cra"
          ],
          "component": "hello_world / esp-idf",
          "level": "component",
          "pointer": null,
          "message": "no hash"
        }
      ]
    }
  },
  "warnings": []
}
